10:58:50.738472 IP 192.168.43.138.22 > 192.168.43.163.55758: Flags [P.], seq 3448614511:3448614571, ack 3549313130, win 273, length 60
10:58:50.740477 IP 192.168.43.138.22 > 192.168.43.163.55758: Flags [P.], seq 60:280, ack 1, win 273, length 220
10:58:50.740679 IP 192.168.43.163.55758 > 192.168.43.138.22: Flags [.], ack 280, win 4103, length 0
10:58:50.742372 IP 192.168.43.138.22 > 192.168.43.163.55758: Flags [P.], seq 280:1604, ack 1, win 273, length 1324
10:58:50.742779 IP 192.168.43.138.22 > 192.168.43.163.55758: Flags [P.], seq 1604:1648, ack 1, win 273, length 44
10:58:50.742911 IP 192.168.43.163.55758 > 192.168.43.138.22: Flags [.], ack 1648, win 4106, length 0
10:58:50.745866 IP 192.168.43.138.22 > 192.168.43.163.55758: Flags [P.], seq 1648:1692, ack 1, win 273, length 44
10:58:50.800452 IP 192.168.43.163.55758 > 192.168.43.138.22: Flags [.], ack 1692, win 4106, length 0
10:59:04.484324 IP6 fe80::1e76:f0da:db11:fa4d > ff02::16: HBH ICMP6, multicast listener report v2, 1 group record(s), length 28
10:59:04.484598 IP 192.168.43.163 > 224.0.0.22: igmp v3 report, 1 group record(s)
10:59:04.505926 IP 192.168.43.163.53434 > 239.255.255.250.1900: UDP, length 137
10:59:04.507658 IP6 fe80::1e76:f0da:db11:fa4d > ff02::16: HBH ICMP6, multicast listener report v2, 1 group record(s), length 28
10:59:04.507685 IP 192.168.43.163 > 224.0.0.22: igmp v3 report, 1 group record(s)
10:59:04.507997 IP6 fe80::1e76:f0da:db11:fa4d > ff02::16: HBH ICMP6, multicast listener report v2, 1 group record(s), length 28
10:59:04.508018 IP 192.168.43.163 > 224.0.0.22: igmp v3 report, 1 group record(s)
10:59:04.508272 IP6 fe80::1e76:f0da:db11:fa4d > ff02::16: HBH ICMP6, multicast listener report v2, 1 group record(s), length 28
10:59:04.508504 IP 192.168.43.163 > 224.0.0.22: igmp v3 report, 1 group record(s)
10:59:04.509567 IP 192.168.43.163.5353 > 224.0.0.251.5353: 0 ANY (QM)? DESKTOP-EGPVFOK.local. (39)
10:59:04.509808 IP6 fe80::1e76:f0da:db11:fa4d.5353 > ff02::fb.5353: 0 ANY (QM)? DESKTOP-EGPVFOK.local. (39)
10:59:04.510141 IP 192.168.43.163.5353 > 224.0.0.251.5353: 0*- [0q] 4/0/0 AAAA 2402:3a80:45fa:5e6d:9793:45de:62d6:cce7, AAAA 2402:3a80:45fa:5e6d:7435:1a20:9b1b:53e2, AAAA fe80::1e76:f0da:db11:fa4d, A 192.168.43.163 (133)
10:59:04.510449 IP6 fe80::1e76:f0da:db11:fa4d.5353 > ff02::fb.5353: 0*- [0q] 4/0/0 AAAA 2402:3a80:45fa:5e6d:9793:45de:62d6:cce7, AAAA 2402:3a80:45fa:5e6d:7435:1a20:9b1b:53e2, AAAA fe80::1e76:f0da:db11:fa4d, A 192.168.43.163 (133)
10:59:04.510484 IP6 fe80::1e76:f0da:db11:fa4d.57406 > ff02::1:3.5355: UDP, length 33
10:59:04.510536 IP 192.168.43.163.57406 > 224.0.0.252.5355: UDP, length 33
10:59:04.559806 IP 192.168.43.163 > 224.0.0.22: igmp v3 report, 1 group record(s)
10:59:04.559835 IP6 fe80::1e76:f0da:db11:fa4d > ff02::16: HBH ICMP6, multicast listener report v2, 1 group record(s), length 28
10:59:07.521920 IP 192.168.43.163.53434 > 239.255.255.250.1900: UDP, length 137
10:59:10.537643 IP 192.168.43.163.53434 > 239.255.255.250.1900: UDP, length 137
10:59:13.561465 IP 192.168.43.163.53434 > 239.255.255.250.1900: UDP, length 137
10:59:16.563372 IP 192.168.43.163.53434 > 239.255.255.250.1900: UDP, length 137
10:59:19.566309 IP 192.168.43.163.53434 > 239.255.255.250.1900: UDP, length 137
10:59:24.291687 IP 192.168.43.138.43143 > 139.84.137.53.123: NTPv4, Client, length 48
10:59:24.508184 IP 139.84.137.53.123 > 192.168.43.138.43143: NTPv4, Server, length 48
10:59:26.062462 IP 192.168.43.163.55758 > 192.168.43.138.22: Flags [P.], seq 1:37, ack 1692, win 4106, length 36
10:59:26.104049 IP 192.168.43.138.22 > 192.168.43.163.55758: Flags [.], ack 37, win 273, length 0
10:59:26.109241 IP 192.168.43.138.22 > 192.168.43.163.55758: Flags [P.], seq 1692:1752, ack 37, win 273, length 60
10:59:26.113027 IP 192.168.43.138.22 > 192.168.43.163.55758: Flags [P.], seq 1752:1852, ack 37, win 273, length 100
10:59:26.113313 IP 192.168.43.163.55758 > 192.168.43.138.22: Flags [.], ack 1852, win 4105, length 0
10:59:26.141778 IP 192.168.43.163.55758 > 192.168.43.138.22: Flags [P.], seq 37:73, ack 1852, win 4105, length 36
10:59:26.141818 IP 192.168.43.138.22 > 192.168.43.163.55758: Flags [.], ack 73, win 273, length 0
10:59:26.150342 IP 192.168.43.138.22 > 192.168.43.163.55758: Flags [P.], seq 1852:1920, ack 73, win 273, length 68
10:59:26.198946 IP 192.168.43.163.55758 > 192.168.43.138.22: Flags [.], ack 1920, win 4105, length 0
10:59:26.369047 IP 192.168.43.138.34412 > 172.232.97.196.123: NTPv4, Client, length 48
10:59:26.396325 IP 192.168.43.163.55758 > 192.168.43.138.22: Flags [P.], seq 73:109, ack 1920, win 4105, length 36
10:59:26.436964 IP 192.168.43.138.22 > 192.168.43.163.55758: Flags [.], ack 109, win 273, length 0
10:59:26.441285 IP 192.168.43.138.22 > 192.168.43.163.55758: Flags [P.], seq 1920:2148, ack 109, win 273, length 228
10:59:26.448738 IP 192.168.43.138.22 > 192.168.43.163.55758: Flags [P.], seq 2148:2200, ack 109, win 273, length 52
10:59:26.448938 IP 192.168.43.163.55758 > 192.168.43.138.22: Flags [.], ack 2200, win 4104, length 0
10:59:26.671506 IP 192.168.43.163.55758 > 192.168.43.138.22: Flags [P.], seq 109:145, ack 2200, win 4104, length 36
10:59:26.671880 IP 192.168.43.138.22 > 192.168.43.163.55758: Flags [.], ack 145, win 273, length 0
10:59:26.693035 IP 192.168.43.138.22 > 192.168.43.163.55758: Flags [P.], seq 2200:2284, ack 145, win 273, length 84
10:59:26.739136 IP 192.168.43.163.55758 > 192.168.43.138.22: Flags [.], ack 2284, win 4103, length 0
10:59:26.863837 IP 172.232.97.196.123 > 192.168.43.138.34412: NTPv4, Server, length 48
10:59:27.122587 IP 192.168.43.163.55758 > 192.168.43.138.22: Flags [P.], seq 145:181, ack 2284, win 4103, length 36
10:59:27.126175 IP 192.168.43.138.22 > 192.168.43.163.55758: Flags [P.], seq 2284:2328, ack 181, win 273, length 44
10:59:27.129946 IP 192.168.43.138.22 > 192.168.43.163.55758: Flags [P.], seq 2328:2380, ack 181, win 273, length 52
10:59:27.130113 IP 192.168.43.163.55758 > 192.168.43.138.22: Flags [.], ack 2380, win 4103, length 0
10:59:27.131150 IP 192.168.43.138.22 > 192.168.43.163.55758: Flags [P.], seq 2380:2432, ack 181, win 273, length 52
10:59:27.131506 IP 192.168.43.138.22 > 192.168.43.163.55758: Flags [P.], seq 2432:2604, ack 181, win 273, length 172
10:59:27.131684 IP 192.168.43.163.55758 > 192.168.43.138.22: Flags [.], ack 2604, win 4102, length 0
10:59:27.131923 IP 192.168.43.138.22 > 192.168.43.163.55758: Flags [P.], seq 2604:2832, ack 181, win 273, length 228
10:59:27.132369 IP 192.168.43.138.22 > 192.168.43.163.55758: Flags [P.], seq 2832:2900, ack 181, win 273, length 68
10:59:27.132541 IP 192.168.43.163.55758 > 192.168.43.138.22: Flags [.], ack 2900, win 4101, length 0
10:59:27.172711 IP 192.168.43.138.22 > 192.168.43.163.55758: Flags [P.], seq 2900:2960, ack 181, win 273, length 60
10:59:27.176874 IP 192.168.43.138.22 > 192.168.43.163.55758: Flags [P.], seq 2960:4284, ack 181, win 273, length 1324
10:59:27.177054 IP 192.168.43.163.55758 > 192.168.43.138.22: Flags [.], ack 4284, win 4106, length 0
10:59:27.177228 IP 192.168.43.138.22 > 192.168.43.163.55758: Flags [P.], seq 4284:4328, ack 181, win 273, length 44
10:59:27.178347 IP 192.168.43.163.55758 > 192.168.43.138.22: Flags [P.], seq 181:217, ack 4328, win 4106, length 36
10:59:27.179901 IP 192.168.43.138.22 > 192.168.43.163.55758: Flags [P.], seq 4328:4372, ack 217, win 273, length 44
10:59:27.220336 IP 192.168.43.163.55758 > 192.168.43.138.22: Flags [.], ack 4372, win 4105, length 0
10:59:29.474877 ARP, Request who-has 192.168.43.1 tell 192.168.43.138, length 28
10:59:30.459589 IP 192.168.43.163.55758 > 192.168.43.138.22: Flags [P.], seq 217:253, ack 4372, win 4105, length 36
10:59:30.474464 IP 192.168.43.138.22 > 192.168.43.163.55758: Flags [P.], seq 4372:4424, ack 253, win 273, length 52
10:59:30.476856 IP 192.168.43.138.22 > 192.168.43.163.55758: Flags [P.], seq 4424:4500, ack 253, win 273, length 76
10:59:30.477000 IP 192.168.43.163.55758 > 192.168.43.138.22: Flags [.], ack 4500, win 4105, length 0
10:59:30.498835 ARP, Request who-has 192.168.43.1 tell 192.168.43.138, length 28
10:59:30.660741 IP 192.168.43.163.55758 > 192.168.43.138.22: Flags [P.], seq 253:289, ack 4500, win 4105, length 36
10:59:30.702697 IP 192.168.43.138.22 > 192.168.43.163.55758: Flags [.], ack 289, win 273, length 0
10:59:30.707145 IP 192.168.43.138.22 > 192.168.43.163.55758: Flags [P.], seq 4500:4648, ack 289, win 273, length 148
10:59:30.710987 IP 192.168.43.138.22 > 192.168.43.163.55758: Flags [P.], seq 4648:4708, ack 289, win 273, length 60
10:59:30.711164 IP 192.168.43.163.55758 > 192.168.43.138.22: Flags [.], ack 4708, win 4104, length 0
10:59:30.968570 IP 192.168.43.163.54995 > 239.255.255.250.1900: UDP, length 175
10:59:31.011367 IP 192.168.43.163.55758 > 192.168.43.138.22: Flags [P.], seq 289:325, ack 4708, win 4104, length 36
10:59:31.011410 IP 192.168.43.138.22 > 192.168.43.163.55758: Flags [.], ack 325, win 273, length 0
10:59:31.013415 IP 192.168.43.138.22 > 192.168.43.163.55758: Flags [P.], seq 4708:4816, ack 325, win 273, length 108
10:59:31.015363 IP 192.168.43.138.22 > 192.168.43.163.55758: Flags [P.], seq 4816:4860, ack 325, win 273, length 44
10:59:31.015550 IP 192.168.43.163.55758 > 192.168.43.138.22: Flags [.], ack 4860, win 4104, length 0
10:59:31.022520 IP 192.168.43.138.22 > 192.168.43.163.55758: Flags [P.], seq 4860:4912, ack 325, win 273, length 52
10:59:31.023575 IP 192.168.43.138.22 > 192.168.43.163.55758: Flags [P.], seq 4912:4980, ack 325, win 273, length 68
10:59:31.023808 IP 192.168.43.163.55758 > 192.168.43.138.22: Flags [.], ack 4980, win 4103, length 0
10:59:31.029094 IP 192.168.43.138.22 > 192.168.43.163.55758: Flags [P.], seq 4980:5824, ack 325, win 273, length 844
10:59:31.029689 IP 192.168.43.138.22 > 192.168.43.163.55758: Flags [P.], seq 5824:6052, ack 325, win 273, length 228
10:59:31.029885 IP 192.168.43.163.55758 > 192.168.43.138.22: Flags [.], ack 6052, win 4106, length 0
10:59:31.030214 IP 192.168.43.138.22 > 192.168.43.163.55758: Flags [P.], seq 6052:6120, ack 325, win 273, length 68
10:59:31.073324 IP 192.168.43.138.22 > 192.168.43.163.55758: Flags [P.], seq 6120:6180, ack 325, win 273, length 60
10:59:31.073501 IP 192.168.43.163.55758 > 192.168.43.138.22: Flags [.], ack 6180, win 4105, length 0
10:59:31.076775 IP 192.168.43.138.22 > 192.168.43.163.55758: Flags [P.], seq 6180:7504, ack 325, win 273, length 1324
10:59:31.077082 IP 192.168.43.138.22 > 192.168.43.163.55758: Flags [P.], seq 7504:7548, ack 325, win 273, length 44
10:59:31.077237 IP 192.168.43.163.55758 > 192.168.43.138.22: Flags [.], ack 7548, win 4106, length 0
10:59:31.079799 IP 192.168.43.138.22 > 192.168.43.163.55758: Flags [P.], seq 7548:7592, ack 325, win 273, length 44
10:59:31.133716 IP 192.168.43.163.55758 > 192.168.43.138.22: Flags [.], ack 7592, win 4106, length 0
10:59:31.522971 ARP, Request who-has 192.168.43.1 tell 192.168.43.138, length 28
10:59:31.976322 IP 192.168.43.163.54995 > 239.255.255.250.1900: UDP, length 175
10:59:32.598686 ARP, Request who-has 192.168.43.138 tell 192.168.43.1, length 46
10:59:32.598751 ARP, Reply 192.168.43.138 is-at 00:0c:29:41:0c:72, length 28
10:59:32.987604 IP 192.168.43.163.54995 > 239.255.255.250.1900: UDP, length 175
10:59:33.435910 IP 192.168.43.138.58284 > 144.24.146.96.123: NTPv4, Client, length 48
10:59:33.599911 IP 192.168.43.163.55758 > 192.168.43.138.22: Flags [P.], seq 325:361, ack 7592, win 4106, length 36
10:59:33.640780 IP 192.168.43.138.22 > 192.168.43.163.55758: Flags [.], ack 361, win 273, length 0
10:59:33.642802 IP 192.168.43.138.22 > 192.168.43.163.55758: Flags [P.], seq 7592:7644, ack 361, win 273, length 52
10:59:33.649939 IP 192.168.43.138.22 > 192.168.43.163.55758: Flags [P.], seq 7644:7704, ack 361, win 273, length 60
10:59:33.650180 IP 192.168.43.163.55758 > 192.168.43.138.22: Flags [.], ack 7704, win 4105, length 0
10:59:33.724908 IP 144.24.146.96.123 > 192.168.43.138.58284: NTPv4, Server, length 48
10:59:33.810292 IP 192.168.43.163.55758 > 192.168.43.138.22: Flags [P.], seq 361:397, ack 7704, win 4105, length 36
10:59:33.810547 IP 192.168.43.138.22 > 192.168.43.163.55758: Flags [.], ack 397, win 273, length 0
10:59:33.835350 IP 192.168.43.138.22 > 192.168.43.163.55758: Flags [P.], seq 7704:7756, ack 397, win 273, length 52
10:59:33.880018 IP 192.168.43.163.55758 > 192.168.43.138.22: Flags [.], ack 7756, win 4105, length 0
10:59:33.974165 IP 192.168.43.163.55758 > 192.168.43.138.22: Flags [P.], seq 397:433, ack 7756, win 4105, length 36
10:59:33.977699 IP 192.168.43.138.22 > 192.168.43.163.55758: Flags [P.], seq 7756:7800, ack 433, win 273, length 44
10:59:33.984556 IP 192.168.43.138.22 > 192.168.43.163.55758: Flags [P.], seq 7800:7852, ack 433, win 273, length 52
10:59:33.984757 IP 192.168.43.163.55758 > 192.168.43.138.22: Flags [.], ack 7852, win 4105, length 0
10:59:33.985643 IP 192.168.43.138.22 > 192.168.43.163.55758: Flags [P.], seq 7852:7920, ack 433, win 273, length 68
10:59:33.988106 IP 192.168.43.163.54995 > 239.255.255.250.1900: UDP, length 175
10:59:33.989996 IP 192.168.43.138.22 > 192.168.43.163.55758: Flags [P.], seq 7920:7972, ack 433, win 273, length 52
10:59:33.990171 IP 192.168.43.163.55758 > 192.168.43.138.22: Flags [.], ack 7972, win 4104, length 0
10:59:33.990290 IP 192.168.43.138.22 > 192.168.43.163.55758: Flags [P.], seq 7972:8096, ack 433, win 273, length 124
10:59:33.990474 IP 192.168.43.138.22 > 192.168.43.163.55758: Flags [P.], seq 8096:8836, ack 433, win 273, length 740
10:59:33.990634 IP 192.168.43.163.55758 > 192.168.43.138.22: Flags [.], ack 8836, win 4101, length 0
10:59:33.991122 IP 192.168.43.138.22 > 192.168.43.163.55758: Flags [P.], seq 8836:9064, ack 433, win 273, length 228
10:59:33.991613 IP 192.168.43.138.22 > 192.168.43.163.55758: Flags [P.], seq 9064:9132, ack 433, win 273, length 68
10:59:33.991796 IP 192.168.43.163.55758 > 192.168.43.138.22: Flags [.], ack 9132, win 4106, length 0
10:59:34.032130 IP 192.168.43.138.22 > 192.168.43.163.55758: Flags [P.], seq 9132:9192, ack 433, win 273, length 60
10:59:34.036172 IP 192.168.43.138.22 > 192.168.43.163.55758: Flags [P.], seq 9192:10516, ack 433, win 273, length 1324
10:59:34.036384 IP 192.168.43.163.55758 > 192.168.43.138.22: Flags [.], ack 10516, win 4100, length 0
10:59:34.036440 IP 192.168.43.138.22 > 192.168.43.163.55758: Flags [P.], seq 10516:10560, ack 433, win 273, length 44
10:59:34.040278 IP 192.168.43.138.22 > 192.168.43.163.55758: Flags [P.], seq 10560:10604, ack 433, win 273, length 44
10:59:34.040460 IP 192.168.43.163.55758 > 192.168.43.138.22: Flags [.], ack 10604, win 4106, length 0
10:59:34.981589 IP 192.168.43.163.55758 > 192.168.43.138.22: Flags [P.], seq 433:469, ack 10604, win 4106, length 36
10:59:35.022034 IP 192.168.43.138.22 > 192.168.43.163.55758: Flags [.], ack 469, win 273, length 0
10:59:35.022840 IP 192.168.43.138.22 > 192.168.43.163.55758: Flags [P.], seq 10604:10656, ack 469, win 273, length 52
10:59:35.029749 IP 192.168.43.138.22 > 192.168.43.163.55758: Flags [P.], seq 10656:10716, ack 469, win 273, length 60
10:59:35.029970 IP 192.168.43.163.55758 > 192.168.43.138.22: Flags [.], ack 10716, win 4105, length 0
10:59:35.140793 IP 192.168.43.163.55758 > 192.168.43.138.22: Flags [P.], seq 469:505, ack 10716, win 4105, length 36
10:59:35.141079 IP 192.168.43.138.22 > 192.168.43.163.55758: Flags [.], ack 505, win 273, length 0
10:59:35.179328 IP 192.168.43.138.22 > 192.168.43.163.55758: Flags [P.], seq 10716:10768, ack 505, win 273, length 52
10:59:35.224757 IP 192.168.43.163.55758 > 192.168.43.138.22: Flags [.], ack 10768, win 4105, length 0
10:59:35.357705 IP 192.168.43.163.55758 > 192.168.43.138.22: Flags [P.], seq 505:541, ack 10768, win 4105, length 36
10:59:35.361305 IP 192.168.43.138.22 > 192.168.43.163.55758: Flags [P.], seq 10768:10812, ack 541, win 273, length 44
10:59:35.368222 IP 192.168.43.138.22 > 192.168.43.163.55758: Flags [P.], seq 10812:10864, ack 541, win 273, length 52
10:59:35.368403 IP 192.168.43.163.55758 > 192.168.43.138.22: Flags [.], ack 10864, win 4105, length 0
10:59:35.369449 IP 192.168.43.138.22 > 192.168.43.163.55758: Flags [P.], seq 10864:10932, ack 541, win 273, length 68
10:59:35.373788 IP 192.168.43.138.22 > 192.168.43.163.55758: Flags [P.], seq 10932:10984, ack 541, win 273, length 52
10:59:35.373943 IP 192.168.43.163.55758 > 192.168.43.138.22: Flags [.], ack 10984, win 4104, length 0
10:59:35.374059 IP 192.168.43.138.22 > 192.168.43.163.55758: Flags [P.], seq 10984:11108, ack 541, win 273, length 124
10:59:35.374197 IP 192.168.43.138.22 > 192.168.43.163.55758: Flags [P.], seq 11108:11848, ack 541, win 273, length 740
10:59:35.374314 IP 192.168.43.163.55758 > 192.168.43.138.22: Flags [.], ack 11848, win 4101, length 0
10:59:35.374877 IP 192.168.43.138.22 > 192.168.43.163.55758: Flags [P.], seq 11848:12076, ack 541, win 273, length 228
10:59:35.375442 IP 192.168.43.138.22 > 192.168.43.163.55758: Flags [P.], seq 12076:12144, ack 541, win 273, length 68
10:59:35.375601 IP 192.168.43.163.55758 > 192.168.43.138.22: Flags [.], ack 12144, win 4106, length 0
10:59:35.420500 IP 192.168.43.138.22 > 192.168.43.163.55758: Flags [P.], seq 12144:12204, ack 541, win 273, length 60
10:59:35.425487 IP 192.168.43.138.22 > 192.168.43.163.55758: Flags [P.], seq 12204:13528, ack 541, win 273, length 1324
10:59:35.425661 IP 192.168.43.163.55758 > 192.168.43.138.22: Flags [.], ack 13528, win 4100, length 0
10:59:35.425786 IP 192.168.43.138.22 > 192.168.43.163.55758: Flags [P.], seq 13528:13572, ack 541, win 273, length 44
10:59:35.428415 IP 192.168.43.138.22 > 192.168.43.163.55758: Flags [P.], seq 13572:13616, ack 541, win 273, length 44
10:59:35.428634 IP 192.168.43.163.55758 > 192.168.43.138.22: Flags [.], ack 13616, win 4106, length 0
10:59:35.887959 IP 192.168.43.163.55758 > 192.168.43.138.22: Flags [P.], seq 541:577, ack 13616, win 4106, length 36
10:59:35.928982 IP 192.168.43.138.22 > 192.168.43.163.55758: Flags [.], ack 577, win 273, length 0
10:59:35.937350 IP 192.168.43.138.22 > 192.168.43.163.55758: Flags [P.], seq 13616:13668, ack 577, win 273, length 52
10:59:35.942396 IP 192.168.43.138.22 > 192.168.43.163.55758: Flags [P.], seq 13668:13728, ack 577, win 273, length 60
10:59:35.942658 IP 192.168.43.163.55758 > 192.168.43.138.22: Flags [.], ack 13728, win 4105, length 0
10:59:36.072915 IP 192.168.43.163.55758 > 192.168.43.138.22: Flags [P.], seq 577:613, ack 13728, win 4105, length 36
10:59:36.073135 IP 192.168.43.138.22 > 192.168.43.163.55758: Flags [.], ack 613, win 273, length 0
10:59:36.110529 IP 192.168.43.138.22 > 192.168.43.163.55758: Flags [P.], seq 13728:13780, ack 613, win 273, length 52
10:59:36.156077 IP 192.168.43.163.55758 > 192.168.43.138.22: Flags [.], ack 13780, win 4105, length 0
10:59:36.259638 IP 192.168.43.163.55758 > 192.168.43.138.22: Flags [P.], seq 613:649, ack 13780, win 4105, length 36
10:59:36.263160 IP 192.168.43.138.22 > 192.168.43.163.55758: Flags [P.], seq 13780:13824, ack 649, win 273, length 44
10:59:36.270600 IP 192.168.43.138.22 > 192.168.43.163.55758: Flags [P.], seq 13824:13876, ack 649, win 273, length 52
10:59:36.270782 IP 192.168.43.163.55758 > 192.168.43.138.22: Flags [.], ack 13876, win 4105, length 0
10:59:36.271863 IP 192.168.43.138.22 > 192.168.43.163.55758: Flags [P.], seq 13876:13944, ack 649, win 273, length 68
10:59:36.275968 IP 192.168.43.138.22 > 192.168.43.163.55758: Flags [P.], seq 13944:13996, ack 649, win 273, length 52
10:59:36.276171 IP 192.168.43.163.55758 > 192.168.43.138.22: Flags [.], ack 13996, win 4104, length 0
10:59:36.276227 IP 192.168.43.138.22 > 192.168.43.163.55758: Flags [P.], seq 13996:14824, ack 649, win 273, length 828
10:59:36.278917 IP 192.168.43.138.22 > 192.168.43.163.55758: Flags [P.], seq 14824:15084, ack 649, win 273, length 260
10:59:36.279086 IP 192.168.43.163.55758 > 192.168.43.138.22: Flags [.], ack 15084, win 4106, length 0
10:59:36.321029 IP 192.168.43.138.22 > 192.168.43.163.55758: Flags [P.], seq 15084:15144, ack 649, win 273, length 60
10:59:36.324163 IP 192.168.43.138.22 > 192.168.43.163.55758: Flags [P.], seq 15144:16468, ack 649, win 273, length 1324
10:59:36.324322 IP 192.168.43.163.55758 > 192.168.43.138.22: Flags [.], ack 16468, win 4100, length 0
10:59:36.324469 IP 192.168.43.138.22 > 192.168.43.163.55758: Flags [P.], seq 16468:16512, ack 649, win 273, length 44
10:59:36.327024 IP 192.168.43.138.22 > 192.168.43.163.55758: Flags [P.], seq 16512:16556, ack 649, win 273, length 44
10:59:36.327212 IP 192.168.43.163.55758 > 192.168.43.138.22: Flags [.], ack 16556, win 4106, length 0
10:59:38.507161 IP 192.168.43.163.55758 > 192.168.43.138.22: Flags [P.], seq 649:685, ack 16556, win 4106, length 36
10:59:38.544147 IP 192.168.43.138.22 > 192.168.43.163.55758: Flags [P.], seq 16556:17888, ack 685, win 273, length 1332
10:59:38.546202 IP 192.168.43.138.22 > 192.168.43.163.55758: Flags [P.], seq 17888:17932, ack 685, win 273, length 44
10:59:38.546511 IP 192.168.43.163.55758 > 192.168.43.138.22: Flags [.], ack 17932, win 4100, length 0
10:59:38.566479 IP 192.168.43.138.22 > 192.168.43.163.55758: Flags [P.], seq 17932:19264, ack 685, win 273, length 1332
10:59:38.567373 IP 192.168.43.138.22 > 192.168.43.163.55758: Flags [P.], seq 19264:19308, ack 685, win 273, length 44
10:59:38.568058 IP 192.168.43.163.55758 > 192.168.43.138.22: Flags [.], ack 19308, win 4106, length 0
10:59:38.690970 ARP, Request who-has 192.168.43.1 tell 192.168.43.138, length 28
10:59:39.102842 IP 192.168.43.163.55758 > 192.168.43.138.22: Flags [P.], seq 685:721, ack 19308, win 4106, length 36
10:59:39.144021 IP 192.168.43.138.22 > 192.168.43.163.55758: Flags [.], ack 721, win 273, length 0
10:59:39.154158 IP 192.168.43.138.22 > 192.168.43.163.55758: Flags [P.], seq 19308:19368, ack 721, win 273, length 60
10:59:39.157519 IP 192.168.43.138.22 > 192.168.43.163.55758: Flags [P.], seq 19368:19444, ack 721, win 273, length 76
10:59:39.157883 IP 192.168.43.163.55758 > 192.168.43.138.22: Flags [.], ack 19444, win 4105, length 0
10:59:39.208396 IP 192.168.43.163.55758 > 192.168.43.138.22: Flags [P.], seq 721:757, ack 19444, win 4105, length 36
10:59:39.208581 IP 192.168.43.138.22 > 192.168.43.163.55758: Flags [.], ack 757, win 273, length 0
10:59:39.233526 IP 192.168.43.138.22 > 192.168.43.163.55758: Flags [P.], seq 19444:19512, ack 757, win 273, length 68
10:59:39.278961 IP 192.168.43.163.55758 > 192.168.43.138.22: Flags [.], ack 19512, win 4105, length 0
10:59:39.547230 IP 192.168.43.163.55758 > 192.168.43.138.22: Flags [P.], seq 757:793, ack 19512, win 4105, length 36
10:59:39.585520 IP 192.168.43.138.22 > 192.168.43.163.55758: Flags [P.], seq 19512:19588, ack 793, win 273, length 76
10:59:39.641162 IP 192.168.43.163.55758 > 192.168.43.138.22: Flags [.], ack 19588, win 4105, length 0
10:59:39.714912 ARP, Request who-has 192.168.43.1 tell 192.168.43.138, length 28
10:59:39.756621 IP 192.168.43.163.55758 > 192.168.43.138.22: Flags [P.], seq 793:829, ack 19588, win 4105, length 36
10:59:39.779610 IP 192.168.43.138.22 > 192.168.43.163.55758: Flags [P.], seq 19588:19672, ack 829, win 273, length 84
10:59:39.827341 IP 192.168.43.163.55758 > 192.168.43.138.22: Flags [.], ack 19672, win 4104, length 0
10:59:39.964816 IP 192.168.43.163.55758 > 192.168.43.138.22: Flags [P.], seq 829:865, ack 19672, win 4104, length 36
10:59:39.968426 IP 192.168.43.138.22 > 192.168.43.163.55758: Flags [P.], seq 19672:19716, ack 865, win 273, length 44
10:59:39.972215 IP 192.168.43.138.22 > 192.168.43.163.55758: Flags [P.], seq 19716:19768, ack 865, win 273, length 52
10:59:39.972405 IP 192.168.43.163.55758 > 192.168.43.138.22: Flags [.], ack 19768, win 4104, length 0
10:59:39.973366 IP 192.168.43.138.22 > 192.168.43.163.55758: Flags [P.], seq 19768:19820, ack 865, win 273, length 52
10:59:39.973601 IP 192.168.43.138.22 > 192.168.43.163.55758: Flags [P.], seq 19820:19992, ack 865, win 273, length 172
10:59:39.973762 IP 192.168.43.163.55758 > 192.168.43.138.22: Flags [.], ack 19992, win 4103, length 0
10:59:39.974139 IP 192.168.43.138.22 > 192.168.43.163.55758: Flags [P.], seq 19992:20220, ack 865, win 273, length 228
10:59:39.974669 IP 192.168.43.138.22 > 192.168.43.163.55758: Flags [P.], seq 20220:20288, ack 865, win 273, length 68
10:59:39.974856 IP 192.168.43.163.55758 > 192.168.43.138.22: Flags [.], ack 20288, win 4102, length 0
10:59:40.013788 IP 192.168.43.138.22 > 192.168.43.163.55758: Flags [P.], seq 20288:20348, ack 865, win 273, length 60
10:59:40.017549 IP 192.168.43.138.22 > 192.168.43.163.55758: Flags [P.], seq 20348:21672, ack 865, win 273, length 1324
10:59:40.017734 IP 192.168.43.163.55758 > 192.168.43.138.22: Flags [.], ack 21672, win 4106, length 0
10:59:40.017888 IP 192.168.43.138.22 > 192.168.43.163.55758: Flags [P.], seq 21672:21716, ack 865, win 273, length 44
10:59:40.020680 IP 192.168.43.138.22 > 192.168.43.163.55758: Flags [P.], seq 21716:21760, ack 865, win 273, length 44
10:59:40.020831 IP 192.168.43.163.55758 > 192.168.43.138.22: Flags [.], ack 21760, win 4105, length 0
10:59:40.739428 ARP, Request who-has 192.168.43.1 tell 192.168.43.138, length 28
11:00:27.516310 ARP, Request who-has 192.168.43.1 tell 192.168.43.138, length 28
11:00:27.522370 ARP, Reply 192.168.43.1 is-at 26:18:1d:e1:55:4b, length 46
11:00:27.522418 IP 192.168.43.138.45114 > 65.0.119.56.123: NTPv4, Client, length 48
11:00:27.572598 IP 65.0.119.56.123 > 192.168.43.138.45114: NTPv4, Server, length 48
11:00:32.733337 ARP, Request who-has 192.168.43.138 tell 192.168.43.1, length 46
11:00:32.733382 ARP, Reply 192.168.43.138 is-at 00:0c:29:41:0c:72, length 28
11:01:30.966867 IP 192.168.43.163.64056 > 239.255.255.250.1900: UDP, length 175
11:01:31.977838 IP 192.168.43.163.64056 > 239.255.255.250.1900: UDP, length 175
11:01:32.977930 IP 192.168.43.163.64056 > 239.255.255.250.1900: UDP, length 175
11:01:33.474189 IP 192.168.43.138.41184 > 139.84.137.53.123: NTPv4, Client, length 48
11:01:33.980006 IP 192.168.43.163.64056 > 239.255.255.250.1900: UDP, length 175
11:01:33.986519 IP 139.84.137.53.123 > 192.168.43.138.41184: NTPv4, Server, length 48
11:01:35.118576 IP 192.168.43.138.36115 > 172.232.97.196.123: NTPv4, Client, length 48
11:01:35.422283 IP 172.232.97.196.123 > 192.168.43.138.36115: NTPv4, Server, length 48
11:01:38.499182 ARP, Request who-has 192.168.43.1 tell 192.168.43.138, length 28
11:01:38.504714 ARP, Reply 192.168.43.1 is-at 26:18:1d:e1:55:4b, length 46
11:01:39.168643 ARP, Request who-has 192.168.43.138 tell 192.168.43.1, length 46
11:01:39.168686 ARP, Reply 192.168.43.138 is-at 00:0c:29:41:0c:72, length 28
11:01:42.422516 IP 192.168.43.138.46772 > 144.24.146.96.123: NTPv4, Client, length 48
11:01:42.599995 IP 144.24.146.96.123 > 192.168.43.138.46772: NTPv4, Server, length 48
11:02:35.786051 IP 192.168.43.138.59053 > 65.0.119.56.123: NTPv4, Client, length 48
11:02:35.844052 IP 65.0.119.56.123 > 192.168.43.138.59053: NTPv4, Server, length 48
11:02:40.963026 ARP, Request who-has 192.168.43.1 tell 192.168.43.138, length 28
11:02:40.967289 ARP, Reply 192.168.43.1 is-at 26:18:1d:e1:55:4b, length 46
11:02:42.929756 ARP, Request who-has 192.168.43.138 tell 192.168.43.1, length 46
11:02:42.929809 ARP, Reply 192.168.43.138 is-at 00:0c:29:41:0c:72, length 28
11:02:50.051733 IP 192.168.43.163.55758 > 192.168.43.138.22: Flags [P.], seq 865:909, ack 21760, win 4105, length 44
11:02:50.077763 IP 192.168.43.138.22 > 192.168.43.163.55758: Flags [P.], seq 21760:21812, ack 909, win 273, length 52
11:02:50.124973 IP 192.168.43.163.55758 > 192.168.43.138.22: Flags [.], ack 21812, win 4105, length 0
11:02:50.558489 IP 192.168.43.163.55758 > 192.168.43.138.22: Flags [P.], seq 909:945, ack 21812, win 4105, length 36
11:02:50.562311 IP 192.168.43.138.22 > 192.168.43.163.55758: Flags [P.], seq 21812:21856, ack 945, win 273, length 44
11:02:50.566346 IP 192.168.43.138.22 > 192.168.43.163.55758: Flags [P.], seq 21856:21908, ack 945, win 273, length 52
11:02:50.566528 IP 192.168.43.163.55758 > 192.168.43.138.22: Flags [.], ack 21908, win 4105, length 0
11:02:50.567798 IP 192.168.43.138.22 > 192.168.43.163.55758: Flags [P.], seq 21908:21960, ack 945, win 273, length 52
11:02:50.568155 IP 192.168.43.138.22 > 192.168.43.163.55758: Flags [P.], seq 21960:22132, ack 945, win 273, length 172
11:02:50.568376 IP 192.168.43.163.55758 > 192.168.43.138.22: Flags [.], ack 22132, win 4104, length 0
11:02:50.568717 IP 192.168.43.138.22 > 192.168.43.163.55758: Flags [P.], seq 22132:22360, ack 945, win 273, length 228
11:02:50.569074 IP 192.168.43.138.22 > 192.168.43.163.55758: Flags [P.], seq 22360:22428, ack 945, win 273, length 68
11:02:50.569254 IP 192.168.43.163.55758 > 192.168.43.138.22: Flags [.], ack 22428, win 4103, length 0
11:02:50.611957 IP 192.168.43.138.22 > 192.168.43.163.55758: Flags [P.], seq 22428:22488, ack 945, win 273, length 60
11:02:50.615346 IP 192.168.43.138.22 > 192.168.43.163.55758: Flags [P.], seq 22488:23812, ack 945, win 273, length 1324
11:02:50.615522 IP 192.168.43.163.55758 > 192.168.43.138.22: Flags [.], ack 23812, win 4106, length 0
11:02:50.615563 IP 192.168.43.138.22 > 192.168.43.163.55758: Flags [P.], seq 23812:23856, ack 945, win 273, length 44
11:02:50.618961 IP 192.168.43.138.22 > 192.168.43.163.55758: Flags [P.], seq 23856:23900, ack 945, win 273, length 44
11:02:50.619144 IP 192.168.43.163.55758 > 192.168.43.138.22: Flags [.], ack 23900, win 4105, length 0
11:02:52.684383 IP 192.168.43.163.55758 > 192.168.43.138.22: Flags [P.], seq 945:981, ack 23900, win 4105, length 36
11:02:52.715827 IP 192.168.43.138.22 > 192.168.43.163.55758: Flags [P.], seq 23900:23952, ack 981, win 273, length 52
11:02:52.721106 IP 192.168.43.138.22 > 192.168.43.163.55758: Flags [P.], seq 23952:24012, ack 981, win 273, length 60
11:02:52.721360 IP 192.168.43.163.55758 > 192.168.43.138.22: Flags [.], ack 24012, win 4105, length 0
11:02:52.879560 IP 192.168.43.163.55758 > 192.168.43.138.22: Flags [P.], seq 981:1017, ack 24012, win 4105, length 36
11:02:52.903064 IP 192.168.43.138.22 > 192.168.43.163.55758: Flags [P.], seq 24012:24064, ack 1017, win 273, length 52
11:02:52.950091 IP 192.168.43.163.55758 > 192.168.43.138.22: Flags [.], ack 24064, win 4105, length 0
11:02:53.610703 IP 192.168.43.163.55758 > 192.168.43.138.22: Flags [P.], seq 1017:1053, ack 24064, win 4105, length 36
11:02:53.614324 IP 192.168.43.138.22 > 192.168.43.163.55758: Flags [P.], seq 24064:24108, ack 1053, win 273, length 44
11:02:53.620965 IP 192.168.43.138.22 > 192.168.43.163.55758: Flags [P.], seq 24108:24160, ack 1053, win 273, length 52
11:02:53.621135 IP 192.168.43.163.55758 > 192.168.43.138.22: Flags [.], ack 24160, win 4104, length 0
11:02:53.621987 IP 192.168.43.138.22 > 192.168.43.163.55758: Flags [P.], seq 24160:24228, ack 1053, win 273, length 68
11:02:53.626310 IP 192.168.43.138.22 > 192.168.43.163.55758: Flags [P.], seq 24228:24280, ack 1053, win 273, length 52
11:02:53.626462 IP 192.168.43.163.55758 > 192.168.43.138.22: Flags [.], ack 24280, win 4104, length 0
11:02:53.626585 IP 192.168.43.138.22 > 192.168.43.163.55758: Flags [P.], seq 24280:25108, ack 1053, win 273, length 828
11:02:53.627359 IP 192.168.43.138.22 > 192.168.43.163.55758: Flags [P.], seq 25108:25336, ack 1053, win 273, length 228
11:02:53.627619 IP 192.168.43.163.55758 > 192.168.43.138.22: Flags [.], ack 25336, win 4106, length 0
11:02:53.627876 IP 192.168.43.138.22 > 192.168.43.163.55758: Flags [P.], seq 25336:25396, ack 1053, win 273, length 60
11:02:53.628093 IP 192.168.43.138.22 > 192.168.43.163.55758: Flags [P.], seq 25396:25440, ack 1053, win 273, length 44
11:02:53.628198 IP 192.168.43.163.55758 > 192.168.43.138.22: Flags [.], ack 25440, win 4105, length 0
11:02:53.672067 IP 192.168.43.138.22 > 192.168.43.163.55758: Flags [P.], seq 25440:25500, ack 1053, win 273, length 60
11:02:53.675498 IP 192.168.43.138.22 > 192.168.43.163.55758: Flags [P.], seq 25500:26824, ack 1053, win 273, length 1324
11:02:53.675683 IP 192.168.43.163.55758 > 192.168.43.138.22: Flags [.], ack 26824, win 4106, length 0
11:02:53.675804 IP 192.168.43.138.22 > 192.168.43.163.55758: Flags [P.], seq 26824:26868, ack 1053, win 273, length 44
11:02:53.678642 IP 192.168.43.138.22 > 192.168.43.163.55758: Flags [P.], seq 26868:26912, ack 1053, win 273, length 44
11:02:53.678885 IP 192.168.43.163.55758 > 192.168.43.138.22: Flags [.], ack 26912, win 4105, length 0
11:03:30.995759 IP 192.168.43.163.58891 > 239.255.255.250.1900: UDP, length 175
11:03:32.004389 IP 192.168.43.163.58891 > 239.255.255.250.1900: UDP, length 175
11:03:33.007913 IP 192.168.43.163.58891 > 239.255.255.250.1900: UDP, length 175
11:03:34.010029 IP 192.168.43.163.58891 > 239.255.255.250.1900: UDP, length 175
11:03:42.685976 IP 192.168.43.138.36944 > 139.84.137.53.123: NTPv4, Client, length 48
11:03:43.013168 IP 139.84.137.53.123 > 192.168.43.138.36944: NTPv4, Server, length 48
11:03:44.456379 IP 192.168.43.138.40573 > 172.232.97.196.123: NTPv4, Client, length 48
11:03:44.804158 IP 172.232.97.196.123 > 192.168.43.138.40573: NTPv4, Server, length 48
11:03:48.034946 ARP, Request who-has 192.168.43.1 tell 192.168.43.138, length 28
11:03:48.045749 ARP, Reply 192.168.43.1 is-at 26:18:1d:e1:55:4b, length 46
11:03:48.617266 ARP, Request who-has 192.168.43.138 tell 192.168.43.1, length 46
11:03:48.617296 ARP, Reply 192.168.43.138 is-at 00:0c:29:41:0c:72, length 28
11:03:51.060740 IP 192.168.43.138.45060 > 144.24.146.96.123: NTPv4, Client, length 48
11:03:51.236163 IP 144.24.146.96.123 > 192.168.43.138.45060: NTPv4, Server, length 48
11:04:17.652268 IP 192.168.43.163.138 > 192.168.43.255.138: UDP, length 201
11:04:44.322041 IP 192.168.43.138.52675 > 65.0.119.56.123: NTPv4, Client, length 48
11:04:44.420420 IP 65.0.119.56.123 > 192.168.43.138.52675: NTPv4, Server, length 48
11:04:48.875986 IP6 fe80::2418:1dff:fee1:554b > ff02::1: ICMP6, router advertisement, length 88
11:04:48.881200 IP6 fe80::20c:29ff:fe41:c72 > ff02::16: HBH ICMP6, multicast listener report v2, 2 group record(s), length 48
11:04:48.930777 IP6 fe80::20c:29ff:fe41:c72 > ff02::16: HBH ICMP6, multicast listener report v2, 2 group record(s), length 48
11:04:49.474845 ARP, Request who-has 192.168.43.1 tell 192.168.43.138, length 28
11:04:49.479705 ARP, Reply 192.168.43.1 is-at 26:18:1d:e1:55:4b, length 46
11:04:49.524125 ARP, Request who-has 192.168.43.138 tell 192.168.43.1, length 46
11:04:49.524168 ARP, Reply 192.168.43.138 is-at 00:0c:29:41:0c:72, length 28
11:05:31.009219 IP 192.168.43.163.54876 > 239.255.255.250.1900: UDP, length 175
11:05:32.020540 IP 192.168.43.163.54876 > 239.255.255.250.1900: UDP, length 175
11:05:33.024193 IP 192.168.43.163.54876 > 239.255.255.250.1900: UDP, length 175
11:05:34.028176 IP 192.168.43.163.54876 > 239.255.255.250.1900: UDP, length 175
11:05:52.239266 IP 192.168.43.138.41732 > 139.84.137.53.123: NTPv4, Client, length 48
11:05:52.581302 IP 139.84.137.53.123 > 192.168.43.138.41732: NTPv4, Server, length 48
11:05:52.953031 IP 192.168.43.138.48760 > 172.232.97.196.123: NTPv4, Client, length 48
11:05:53.183974 IP 172.232.97.196.123 > 192.168.43.138.48760: NTPv4, Server, length 48
11:05:57.570734 ARP, Request who-has 192.168.43.1 tell 192.168.43.138, length 28
11:05:57.574979 ARP, Reply 192.168.43.1 is-at 26:18:1d:e1:55:4b, length 46
11:06:00.277836 ARP, Request who-has 192.168.43.138 tell 192.168.43.1, length 46
11:06:00.277860 ARP, Reply 192.168.43.138 is-at 00:0c:29:41:0c:72, length 28
11:06:01.112499 IP 192.168.43.163.55758 > 192.168.43.138.22: Flags [P.], seq 1053:1097, ack 26912, win 4105, length 44
11:06:01.142900 IP 192.168.43.138.22 > 192.168.43.163.55758: Flags [P.], seq 26912:26964, ack 1097, win 273, length 52
11:06:01.188178 IP 192.168.43.163.55758 > 192.168.43.138.22: Flags [.], ack 26964, win 4105, length 0
11:06:01.550111 IP 192.168.43.138.39282 > 144.24.146.96.123: NTPv4, Client, length 48
11:06:01.739560 IP 192.168.43.163.55758 > 192.168.43.138.22: Flags [P.], seq 1097:1141, ack 26964, win 4105, length 44
11:06:01.762047 IP 144.24.146.96.123 > 192.168.43.138.39282: NTPv4, Server, length 48
11:06:01.767381 IP 192.168.43.138.22 > 192.168.43.163.55758: Flags [P.], seq 26964:27024, ack 1141, win 273, length 60
11:06:01.823081 IP 192.168.43.163.55758 > 192.168.43.138.22: Flags [.], ack 27024, win 4105, length 0
11:06:02.231375 IP 192.168.43.163.55758 > 192.168.43.138.22: Flags [P.], seq 1141:1177, ack 27024, win 4105, length 36
11:06:02.234976 IP 192.168.43.138.22 > 192.168.43.163.55758: Flags [P.], seq 27024:27068, ack 1177, win 273, length 44
11:06:02.239445 IP 192.168.43.138.22 > 192.168.43.163.55758: Flags [P.], seq 27068:27120, ack 1177, win 273, length 52
11:06:02.239638 IP 192.168.43.163.55758 > 192.168.43.138.22: Flags [.], ack 27120, win 4105, length 0
11:06:02.241039 IP 192.168.43.138.22 > 192.168.43.163.55758: Flags [P.], seq 27120:27172, ack 1177, win 273, length 52
11:06:02.241580 IP 192.168.43.138.22 > 192.168.43.163.55758: Flags [P.], seq 27172:27344, ack 1177, win 273, length 172
11:06:02.241764 IP 192.168.43.163.55758 > 192.168.43.138.22: Flags [.], ack 27344, win 4104, length 0
11:06:02.242318 IP 192.168.43.138.22 > 192.168.43.163.55758: Flags [P.], seq 27344:27572, ack 1177, win 273, length 228
11:06:02.243064 IP 192.168.43.138.22 > 192.168.43.163.55758: Flags [P.], seq 27572:27640, ack 1177, win 273, length 68
11:06:02.243219 IP 192.168.43.163.55758 > 192.168.43.138.22: Flags [.], ack 27640, win 4103, length 0
11:06:02.283030 IP 192.168.43.138.22 > 192.168.43.163.55758: Flags [P.], seq 27640:27700, ack 1177, win 273, length 60
11:06:02.286711 IP 192.168.43.138.22 > 192.168.43.163.55758: Flags [P.], seq 27700:29024, ack 1177, win 273, length 1324
11:06:02.286883 IP 192.168.43.163.55758 > 192.168.43.138.22: Flags [.], ack 29024, win 4106, length 0
11:06:02.287062 IP 192.168.43.138.22 > 192.168.43.163.55758: Flags [P.], seq 29024:29068, ack 1177, win 273, length 44
11:06:02.290081 IP 192.168.43.138.22 > 192.168.43.163.55758: Flags [P.], seq 29068:29112, ack 1177, win 273, length 44
11:06:02.290389 IP 192.168.43.163.55758 > 192.168.43.138.22: Flags [.], ack 29112, win 4105, length 0
11:06:04.829476 IP 192.168.43.163.55758 > 192.168.43.138.22: Flags [P.], seq 1177:1213, ack 29112, win 4105, length 36
11:06:04.840330 IP 192.168.43.138.22 > 192.168.43.163.55758: Flags [P.], seq 29112:29164, ack 1213, win 273, length 52
11:06:04.843131 IP 192.168.43.138.22 > 192.168.43.163.55758: Flags [P.], seq 29164:29224, ack 1213, win 273, length 60
11:06:04.843286 IP 192.168.43.163.55758 > 192.168.43.138.22: Flags [.], ack 29224, win 4105, length 0
11:06:05.058853 IP 192.168.43.163.55758 > 192.168.43.138.22: Flags [P.], seq 1213:1249, ack 29224, win 4105, length 36
11:06:05.078426 IP 192.168.43.138.22 > 192.168.43.163.55758: Flags [P.], seq 29224:29276, ack 1249, win 273, length 52
11:06:05.122973 IP 192.168.43.163.55758 > 192.168.43.138.22: Flags [.], ack 29276, win 4105, length 0
11:06:06.719637 IP 192.168.43.163.55758 > 192.168.43.138.22: Flags [P.], seq 1249:1285, ack 29276, win 4105, length 36
11:06:06.723207 IP 192.168.43.138.22 > 192.168.43.163.55758: Flags [P.], seq 29276:29320, ack 1285, win 273, length 44
11:06:06.730827 IP 192.168.43.138.22 > 192.168.43.163.55758: Flags [P.], seq 29320:29372, ack 1285, win 273, length 52
11:06:06.731059 IP 192.168.43.163.55758 > 192.168.43.138.22: Flags [.], ack 29372, win 4104, length 0
11:06:06.732142 IP 192.168.43.138.22 > 192.168.43.163.55758: Flags [P.], seq 29372:29440, ack 1285, win 273, length 68
11:06:06.737090 IP 192.168.43.138.22 > 192.168.43.163.55758: Flags [P.], seq 29440:29492, ack 1285, win 273, length 52
11:06:06.737249 IP 192.168.43.163.55758 > 192.168.43.138.22: Flags [.], ack 29492, win 4104, length 0
11:06:06.737293 IP 192.168.43.138.22 > 192.168.43.163.55758: Flags [P.], seq 29492:29840, ack 1285, win 273, length 348
11:06:06.737417 IP 192.168.43.138.22 > 192.168.43.163.55758: Flags [P.], seq 29840:30364, ack 1285, win 273, length 524
11:06:06.737557 IP 192.168.43.163.55758 > 192.168.43.138.22: Flags [.], ack 30364, win 4101, length 0
11:06:06.738214 IP 192.168.43.138.22 > 192.168.43.163.55758: Flags [P.], seq 30364:30592, ack 1285, win 273, length 228
